instrument_code,article_ref,topic_tags,applicability_notes
GR_LAW_4014_2011,Art3,"AEPO;A1;MPE;consultation","A1 AEPO procedure steps and working-day deadlines."
GR_LAW_4014_2011,Art4,"AEPO;A2;MPE;deadlines","A2 AEPO procedure steps (reduced deadlines)."
GR_LAW_4014_2011,Art19a,"publication;AEPO","AEPO publication requirement within one month."
GR_LAW_2690_1999,Art24,"administrative remedy;deadlines","Administrative remedy response timeline."
GR_PD_18_1989,Art45-46,"annulment;omission;deadlines","60-day annulment action and omission rules."
